<?xml version="1.0" encoding="UTF-8"?>
<!DOCTYPE Bean SYSTEM "../JavaBean.dtd">
<Bean class="com.chaosserver.merp.rules.skill.SkillCategory">
  <Property name="Name">
    <Object class="java.lang.String">Magical</Object>
  </Property>
  <Property name="SkillList">
    <Collection class="java.util.ArrayList">
      <Bean class="com.chaosserver.merp.rules.skill.Skill">
        <Property name="Name">
          <Object class="java.lang.String">Read Rune</Object>
        </Property>
        <Property name="Stat">
          <Findable class="com.chaosserver.merp.rules.stat.Stat" finderClass="com.chaosserver.merp.rules.stat.StatFinder" finderKey="Name">Intelligence</Findable>
        </Property>
        <Property name="ProgressionList">
          <Bean class="com.chaosserver.merp.rules.skill.ProgressionList">
            <Property name="ProgressionList">
              <Collection class="java.util.ArrayList">
                <Object class="java.lang.Integer">1</Object>
                <Object class="java.lang.Integer">2</Object>
              </Collection>
            </Property>
          </Bean>
        </Property>
        <Property name="Id">
          <Object class="java.lang.Integer">20</Object>
        </Property>
      </Bean>

      <Bean class="com.chaosserver.merp.rules.skill.Skill">
        <Property name="Name">
          <Object class="java.lang.String">Use Item</Object>
        </Property>
        <Property name="Stat">
          <Findable class="com.chaosserver.merp.rules.stat.Stat" finderClass="com.chaosserver.merp.rules.stat.StatFinder" finderKey="Name">Intelligence</Findable>
        </Property>
        <Property name="ProgressionList">
          <Bean class="com.chaosserver.merp.rules.skill.ProgressionList">
            <Property name="ProgressionList">
              <Collection class="java.util.ArrayList">
                <Object class="java.lang.Integer">1</Object>
                <Object class="java.lang.Integer">2</Object>
              </Collection>
            </Property>
          </Bean>
        </Property>
        <Property name="Id">
          <Object class="java.lang.Integer">21</Object>
        </Property>
      </Bean>

      <Bean class="com.chaosserver.merp.rules.skill.Skill">
        <Property name="Name">
          <Object class="java.lang.String">Directed Spells</Object>
        </Property>
        <Property name="Stat">
          <Findable class="com.chaosserver.merp.rules.stat.Stat" finderClass="com.chaosserver.merp.rules.stat.StatFinder" finderKey="Name">Agility</Findable>
        </Property>
        <Property name="ProgressionList">
          <Bean class="com.chaosserver.merp.rules.skill.ProgressionList">
            <Property name="ProgressionList">
              <Collection class="java.util.ArrayList">
                <Object class="java.lang.Integer">1</Object>
                <Object class="java.lang.Integer">2</Object>
              </Collection>
            </Property>
          </Bean>
        </Property>
        <Property name="Id">
          <Object class="java.lang.Integer">22</Object>
        </Property>
      </Bean>
    </Collection>
  </Property>
</Bean>